Experiment,Type,Objective,Safety Charm,Status,Hilarity Score,Lead,Notes
Moonbeam Meltdrops shimmer test,Candy,Create moonlit sparkle without sticky fallout,Lumos Buffer,Stable,8,Fred,Customers gasped in a commercially useful way
Portable Swamp Taffy puff trial,Prank,Cover a corridor in harmless marsh fog,Anti-Bog Hex,Unstable,10,George,Spectacular but one stool still missing
Canary Cream party tin timing,Candy,Keep transformation short and charming,Feather Reversal Charm,Tuning,9,Lee Jordan,Current timing is funny unless you are speaking
Patronus Pop Rocks glow blend,Candy,Increase visual crackle at night,Shielding Net,Stable,7,Hermione,Needs cleaner flavor finish
Howler Fudge loudness cap,Prank,Cut volume before legal notices,Silencio Ring,Blocked,6,George,Still yells at portraits for too long
